{
  "command_id": "019c2d5d-f20a-7a8a-8d8e-4a5f6f5d5a50",
  "command_type": "org.contextualwisdomlab.identity.account.provision.v1",
  "command_version": "1.0.0",
  "tenant_id": "tenant:example",
  "actor_reference": "worker:opaque_4J8V",
  "subject_reference": "person:opaque_9AT2",
  "purpose_code": "workforce_provisioning",
  "requested_at": "2026-08-15T11:21:00Z",
  "idempotency_key": "provision-person-opaque_9AT2-20260815",
  "correlation_id": "019c2d5d-f20a-7d8a-9d8e-4a5f6f5d5a42",
  "causation_id": "019c2d5d-f20a-7f8a-8d8e-4a5f6f5d5a41",
  "decision_reference": "employment_decision:opaque_4NK1",
  "provenance_reference": "urn:cwl:provenance:prov_4NN2",
  "data_classification": "restricted_hr",
  "traceparent": "00-4bf92f3577b34da6a3ce929d0e0e4736-00f067aa0ba902b7-01",
  "payload": {
    "requested_capability": "organization_access"
  }
}
